{
  "id": "uc-egg-pcs-g-v2",
  "schemaVersion": "1",
  "context": {
    "ingredientRef": "ing-egg"
  },
  "from": "pcs",
  "to": "g",
  "factor": 50,
  "effectiveFrom": "2026-11-01",
  "supersedes": "uc-egg-pcs-g-v1",
  "source": {
    "type": "measured",
    "detail": "改用去壳可食部口径：带壳 55 g × 0.91 ≈ 50 g；2026-10 后厨复核确认"
  },
  "note": {
    "zh": "自 2026-11-01 起按去壳净蛋 50 g/枚 计；旧规则 uc-egg-pcs-g-v1 保留用于历史采购单复算",
    "en": "From 2026-11-01 eggs are counted as 50 g shelled net weight; uc-egg-pcs-g-v1 is retained for historical PO recomputation",
    "uk": "З 01.11.2026 яйця рахуються як 50 г без шкаралупи; uc-egg-pcs-g-v1 збережено для перерахунку історичних замовлень"
  },
  "status": "active"
}
